{
  "clinical": {
    "care_plan_summary": "Assist with mobility exercises and document functional progress.",
    "medications": [],
    "primary_diagnosis_icd10": "M79.3"
  },
  "demographics": {
    "date_of_birth": "1952-11-08",
    "first_name": "Jordan",
    "last_name": "Demohealth2",
    "mrn": "MRN-SYN-000002"
  },
  "metadata": {
    "generated_at": "2026-09-07T02:00:00+00:00",
    "generator_version": "1.0.0",
    "synthetic_data_notice": "SYNTHETIC_EPHI_LAB_DATA_ONLY"
  },
  "patient_id": "SYN-000002",
  "record_type": "home_health_visit",
  "visit": {
    "caregiver_npi": "9997654321",
    "service_type": "physical_therapy",
    "visit_date": "2026-08-15",
    "visit_duration_minutes": 90
  }
}
